{
  "$schema": "http://json-schema.org/draft-07/schema#",
  "title": "cppulse Static Analysis Findings",
  "type": "object",
  "required": ["version", "metadata", "findings", "summary"],
  "properties": {
    "version": { "type": "string", "const": "1.0.0" },
    "metadata": {
      "type": "object",
      "required": ["repo_path", "analyzed_at", "file_count", "total_loc"],
      "properties": {
        "repo_path": { "type": "string" },
        "analyzed_at": { "type": "string", "format": "date-time" },
        "file_count": { "type": "integer", "minimum": 0 },
        "total_loc": { "type": "integer", "minimum": 0 }
      }
    },
    "findings": {
      "type": "array",
      "items": {
        "type": "object",
        "required": ["rule_id", "category", "severity", "file", "line", "message"],
        "properties": {
          "rule_id": { "type": "string", "pattern": "^(CPP-MEM|CPP-MOD|CPP-CX|MISRA)-\\d{3}$" },
          "category": { "enum": ["memory_safety", "modernization", "complexity", "misra"] },
          "severity": { "enum": ["error", "warning", "info"] },
          "file": { "type": "string" },
          "line": { "type": "integer", "minimum": 1 },
          "column": { "type": "integer", "minimum": 1 },
          "end_line": { "type": "integer", "minimum": 1 },
          "message": { "type": "string" },
          "suggestion": { "type": "string" },
          "confidence": { "type": "number", "minimum": 0.0, "maximum": 1.0 }
        }
      }
    },
    "summary": {
      "type": "object",
      "required": ["total_findings", "by_category", "by_severity"],
      "properties": {
        "total_findings": { "type": "integer" },
        "by_category": {
          "type": "object",
          "properties": {
            "memory_safety": { "type": "integer" },
            "modernization": { "type": "integer" },
            "complexity": { "type": "integer" },
            "misra": { "type": "integer" }
          }
        },
        "by_severity": {
          "type": "object",
          "properties": {
            "error": { "type": "integer" },
            "warning": { "type": "integer" },
            "info": { "type": "integer" }
          }
        }
      }
    }
  }
}
