{
  "findings": [
    {
      "category": "memory_safety",
      "column": 24,
      "confidence": 1.0,
      "file": "/tmp/leveldb/benchmarks/db_bench.cc",
      "line": 411,
      "message": "Raw 'new' expression detected; prefer std::make_unique or std::make_shared",
      "rule_id": "CPP-MEM-001",
      "severity": "warning",
      "suggestion": "Replace 'new T(...)' with 'std::make_unique<T>(...)'"
    },
    {
      "category": "memory_safety",
      "column": 3,
      "confidence": 1.0,
      "file": "/tmp/leveldb/benchmarks/db_bench.cc",
      "line": 417,
      "message": "Explicit 'delete' detected; prefer smart pointers for automatic lifetime management",
      "rule_id": "CPP-MEM-002",
      "severity": "warning",
      "suggestion": "Use std::unique_ptr or std::shared_ptr to avoid manual delete"
    },
    {
      "category": "modernization",
      "column": 5,
      "confidence": 0.7,
      "file": "/tmp/leveldb/benchmarks/db_bench.cc",
      "line": 715,
      "message": "Index-based for loop may be replaceable with a range-based for loop",
      "rule_id": "CPP-MOD-006",
      "severity": "info",
      "suggestion": "Consider 'for (const auto& elem : container)' instead"
    },
    {
      "category": "complexity",
      "column": 8,
      "confidence": 1.0,
      "file": "/tmp/leveldb/benchmarks/db_bench.cc",
      "line": 552,
      "message": "Function 'Run' has cyclomatic complexity of 36 (threshold: warning>15, error>25)",
      "rule_id": "CPP-CX-001",
      "severity": "error",
      "suggestion": "Decompose into smaller functions to reduce complexity"
    },
    {
      "category": "complexity",
      "column": 3,
      "confidence": 1.0,
      "end_line": 672,
      "file": "/tmp/leveldb/benchmarks/db_bench.cc",
      "line": 552,
      "message": "Function 'Run' is 121 lines long (threshold: warning>80, error>150)",
      "rule_id": "CPP-CX-002",
      "severity": "warning",
      "suggestion": "Decompose into smaller helper functions"
    },
    {
      "category": "misra",
      "column": 12,
      "confidence": 0.9,
      "file": "/tmp/leveldb/benchmarks/db_bench.cc",
      "line": 175,
      "message": "Variable 'rnd' of type 'int' declared without an initializer",
      "rule_id": "MISRA-007",
      "severity": "warning",
      "suggestion": "Initialize 'rnd' at the point of declaration"
    },
    {
      "category": "modernization",
      "column": 46,
      "confidence": 1.0,
      "file": "/tmp/leveldb/benchmarks/db_bench_log.cc",
      "line": 83,
      "message": "C-style cast bypasses C++ type-safety checks",
      "rule_id": "CPP-MOD-001",
      "severity": "warning",
      "suggestion": "Replace with static_cast<T>, dynamic_cast<T>, or reinterpret_cast<T>"
    },
    {
      "category": "modernization",
      "column": 8,
      "confidence": 1.0,
      "file": "/tmp/leveldb/benchmarks/db_bench_sqlite3.cc",
      "line": 315,
      "message": "Unscoped enum 'Order' pollutes the enclosing namespace and allows implicit integer conversion",
      "rule_id": "CPP-MOD-008",
      "severity": "warning",
      "suggestion": "Replace 'enum Order' with 'enum class Order'"
    },
    {
      "category": "complexity",
      "column": 8,
      "confidence": 1.0,
      "file": "/tmp/leveldb/benchmarks/db_bench_sqlite3.cc",
      "line": 483,
      "message": "Function 'Write' has 6 parameters (threshold: warning>5, error>8)",
      "rule_id": "CPP-CX-003",
      "severity": "warning",
      "suggestion": "Introduce a parameter struct or builder pattern to reduce parameter count"
    },
    {
      "category": "misra",
      "column": 23,
      "confidence": 1.0,
      "file": "/tmp/leveldb/db/autocompact_test.cc",
      "line": 59,
      "message": "Function 'DoReads' has 3 return statements; MISRA Rule 6-6-5 requires a single exit point",
      "rule_id": "MISRA-006",
      "severity": "warning",
      "suggestion": "Restructure function so all exit paths go through a single return"
    },
    {
      "category": "modernization",
      "column": 1,
      "confidence": 1.0,
      "file": "/tmp/leveldb/db/c.cc",
      "line": 7,
      "message": "Deprecated C header <string.h> included; prefer the C++ equivalent",
      "rule_id": "CPP-MOD-002",
      "severity": "warning",
      "suggestion": "Replace <string.h> with <cstring>"
    },
    {
      "category": "misra",
      "column": 5,
      "confidence": 1.0,
      "file": "/tmp/leveldb/db/c.cc",
      "line": 124,
      "message": "Dynamic allocation via 'free()' violates MISRA C++ Rule 18-4-1 (no dynamic heap allocation)",
      "rule_id": "MISRA-004",
      "severity": "error",
      "suggestion": "Use stack allocation, std::array, or a pre-allocated memory pool"
    },
    {
      "category": "modernization",
      "column": 5,
      "confidence": 0.9,
      "file": "/tmp/leveldb/db/db_test.cc",
      "line": 1233,
      "message": "String literal contains 4 escape sequences; consider a raw string literal for readability",
      "rule_id": "CPP-MOD-004",
      "severity": "info",
      "suggestion": "Replace escaped string with R\"(...)\" raw string literal"
    },
    {
      "category": "modernization",
      "column": 44,
      "confidence": 1.0,
      "file": "/tmp/leveldb/db/db_test.cc",
      "line": 2105,
      "message": "typedef 'KVMap' should use a C++11 type alias instead",
      "rule_id": "CPP-MOD-009",
      "severity": "info",
      "suggestion": "Replace 'typedef int KVMap' with 'using KVMap = int'"
    },
    {
      "category": "misra",
      "column": 10,
      "confidence": 1.0,
      "file": "/tmp/leveldb/db/dbformat.h",
      "line": 168,
      "message": "Function 'Compare' is recursive, making stack depth analysis impossible",
      "rule_id": "MISRA-005",
      "severity": "error",
      "suggestion": "Replace recursive implementation with an iterative one"
    },
    {
      "category": "modernization",
      "column": 35,
      "confidence": 1.0,
      "file": "/tmp/leveldb/db/version_set.cc",
      "line": 1376,
      "message": "NULL macro used as null pointer constant; prefer nullptr",
      "rule_id": "CPP-MOD-007",
      "severity": "warning",
      "suggestion": "Replace NULL with nullptr"
    },
    {
      "category": "memory_safety",
      "column": 22,
      "confidence": 1.0,
      "file": "/tmp/leveldb/benchmarks/db_bench.cc",
      "line": 714,
      "message": "Raw 'new' expression detected; prefer std::make_unique or std::make_shared",
      "rule_id": "CPP-MEM-001",
      "severity": "warning",
      "suggestion": "Replace 'new T(...)' with 'std::make_unique<T>(...)'"
    },
    {
      "category": "memory_safety",
      "column": 23,
      "confidence": 1.0,
      "file": "/tmp/leveldb/benchmarks/db_bench.cc",
      "line": 723,
      "message": "Raw 'new' expression detected; prefer std::make_unique or std::make_shared",
      "rule_id": "CPP-MEM-001",
      "severity": "warning",
      "suggestion": "Replace 'new T(...)' with 'std::make_unique<T>(...)'"
    },
    {
      "category": "memory_safety",
      "column": 7,
      "confidence": 1.0,
      "file": "/tmp/leveldb/benchmarks/db_bench.cc",
      "line": 751,
      "message": "Explicit 'delete' detected; prefer smart pointers for automatic lifetime management",
      "rule_id": "CPP-MEM-002",
      "severity": "warning",
      "suggestion": "Use std::unique_ptr or std::shared_ptr to avoid manual delete"
    },
    {
      "category": "memory_safety",
      "column": 5,
      "confidence": 1.0,
      "file": "/tmp/leveldb/benchmarks/db_bench.cc",
      "line": 753,
      "message": "Explicit 'delete' detected; prefer smart pointers for automatic lifetime management",
      "rule_id": "CPP-MEM-002",
      "severity": "warning",
      "suggestion": "Use std::unique_ptr or std::shared_ptr to avoid manual delete"
    },
    {
      "category": "memory_safety",
      "column": 5,
      "confidence": 1.0,
      "file": "/tmp/leveldb/benchmarks/db_bench.cc",
      "line": 877,
      "message": "Explicit 'delete' detected; prefer smart pointers for automatic lifetime management",
      "rule_id": "CPP-MEM-002",
      "severity": "warning",
      "suggestion": "Use std::unique_ptr or std::shared_ptr to avoid manual delete"
    },
    {
      "category": "memory_safety",
      "column": 5,
      "confidence": 1.0,
      "file": "/tmp/leveldb/benchmarks/db_bench.cc",
      "line": 890,
      "message": "Explicit 'delete' detected; prefer smart pointers for automatic lifetime management",
      "rule_id": "CPP-MEM-002",
      "severity": "warning",
      "suggestion": "Use std::unique_ptr or std::shared_ptr to avoid manual delete"
    },
    {
      "category": "memory_safety",
      "column": 7,
      "confidence": 1.0,
      "file": "/tmp/leveldb/benchmarks/db_bench.cc",
      "line": 948,
      "message": "Explicit 'delete' detected; prefer smart pointers for automatic lifetime management",
      "rule_id": "CPP-MEM-002",
      "severity": "warning",
      "suggestion": "Use std::unique_ptr or std::shared_ptr to avoid manual delete"
    },
    {
      "category": "memory_safety",
      "column": 5,
      "confidence": 1.0,
      "file": "/tmp/leveldb/benchmarks/db_bench.cc",
      "line": 969,
      "message": "Explicit 'delete' detected; prefer smart pointers for automatic lifetime management",
      "rule_id": "CPP-MEM-002",
      "severity": "warning",
      "suggestion": "Use std::unique_ptr or std::shared_ptr to avoid manual delete"
    },
    {
      "category": "memory_safety",
      "column": 5,
      "confidence": 1.0,
      "file": "/tmp/leveldb/benchmarks/db_bench.cc",
      "line": 1056,
      "message": "Explicit 'delete' detected; prefer smart pointers for automatic lifetime management",
      "rule_id": "CPP-MEM-002",
      "severity": "warning",
      "suggestion": "Use std::unique_ptr or std::shared_ptr to avoid manual delete"
    },
    {
      "category": "modernization",
      "column": 5,
      "confidence": 0.7,